{
  "$schema": "http://json-schema.org/draft-07/schema#",
  "$id": "property-meta.json",
  "title": "PropertyMeta",
  "description": "Workflow metadata for a property candidate",
  "type": "object",
  "required": ["id", "address", "listing_url", "workflow_state", "created_at", "updated_at"],
  "properties": {
    "id": {
      "type": "string",
      "description": "Stable slug identifier"
    },
    "address": {
      "type": "string"
    },
    "location": {
      "type": "string",
      "description": "City, state, etc."
    },
    "listing_url": {
      "type": "string",
      "format": "uri"
    },
    "workflow_state": {
      "type": "string",
      "enum": [
        "CANDIDATE",
        "SCREENED",
        "RESEARCHING",
        "READY_FOR_UNDERWRITING",
        "UNDERWRITTEN",
        "AUDIT",
        "RANKED",
        "PUBLISHED",
        "ARCHIVED"
      ]
    },
    "scout_decision": {
      "type": "string",
      "enum": ["REJECT", "RESEARCH"]
    },
    "property_type": {
      "type": "string",
      "description": "condo, townhouse, single_family, etc."
    },
    "building_name": {
      "type": "string",
      "description": "Condo association or building name when known"
    },
    "unit": {
      "type": "string",
      "description": "Unit number for condos"
    },
    "scout_notes": {
      "type": "string",
      "description": "Scout screening notes, reject rationale for borderline cases"
    },
    "archive_reason": {
      "type": "string",
      "enum": [
        "scout_reject",
        "underwrite_reject",
        "audit_reject",
        "watchlist",
        "listing_inactive"
      ],
      "description": "Why the property left the active pipeline"
    },
    "rescreen_after": {
      "type": "string",
      "format": "date-time",
      "description": "Earliest time Scout should re-check this listing"
    },
    "last_screened_at": {
      "type": "string",
      "format": "date-time"
    },
    "rescreen_count": {
      "type": "integer",
      "minimum": 0,
      "description": "Number of times this listing has been rescreened"
    },
    "screening_snapshot": {
      "type": "object",
      "description": "Last known screening inputs for change detection on rescreen",
      "properties": {
        "price": { "type": "number" },
        "rough_monthly_rent": { "type": "number" },
        "rough_gross_yield": { "type": "number" },
        "advertised_hoa": { "type": ["number", "null"] },
        "screened_at": { "type": "string", "format": "date-time" }
      }
    },
    "beds": {
      "type": "integer",
      "minimum": 0,
      "description": "Number of bedrooms"
    },
    "baths": {
      "type": "number",
      "minimum": 0,
      "description": "Number of bathrooms (can be fractional, e.g., 1.5)"
    },
    "asking_price": {
      "type": "number",
      "minimum": 0,
      "description": "Current listing asking price"
    },
    "rough_monthly_rent": {
      "type": "number",
      "minimum": 0,
      "description": "Scout's rough estimate of monthly rent"
    },
    "rough_gross_yield": {
      "type": "number",
      "minimum": 0,
      "maximum": 1,
      "description": "Scout's rough gross yield calculation (annual rent / price)"
    },
    "advertised_hoa": {
      "type": ["number", "null"],
      "minimum": 0,
      "description": "Advertised monthly HOA fee from listing, null if not stated"
    },
    "market_id": {
      "type": "string",
      "description": "Market identifier matching search-criteria.json markets[].id"
    },
    "mls_id": {
      "type": "string",
      "description": "MLS listing identifier"
    },
    "rent_source": {
      "type": "string",
      "description": "Source of the rent estimate (e.g., Zillow, Rentometer, listing)"
    },
    "rent_confidence": {
      "type": "string",
      "enum": ["HIGH", "MEDIUM", "LOW"],
      "description": "Scout's confidence in the rent estimate"
    },
    "created_at": {
      "type": "string",
      "format": "date-time"
    },
    "updated_at": {
      "type": "string",
      "format": "date-time"
    }
  },
  "additionalProperties": true
}
