{
  "id": "nahla-unit-d-203-barbasquillo-manta-ec",
  "address": "Nahla Unit D-203, Barbasquillo, Manta, Manabí, Ecuador",
  "location": "Manta, Manabí, Ecuador",
  "listing_url": "https://trivo.com.ec/propiedades/nahla/",
  "market_id": "manta-ec",
  "created_at": "2026-08-10T05:00:00Z",
  "updated_at": "2026-10-17T11:17:00Z",
  "last_screened_at": "2026-10-17T11:17:00Z",
  "screening_snapshot": {
    "price": 93949,
    "rough_monthly_rent": 732,
    "rough_gross_yield": 0.0935,
    "advertised_hoa": null,
    "screened_at": "2026-10-17T11:17:00Z"
  },
  "scout_notes": "Rescreen 2026-10-17: trivo.com.ec / propiedades/nahla direct fetch egress-blocked (domain not in allowlist; curl SSL_ERROR_SYSCALL / WebFetch reject). WebSearch for Nahla Barbasquillo / Unit D-203 / $93,949 / 81.44 m² returned no sold, offline, or price-update signal. Sibling Nahla D-204/D-106 still ARCHIVED on same Trivo project URL — inventory treated as still marketed. Holding last-known Trivo Unidades disponibles ask $93,949 / 81.44 m² 2BR matching D-203 (0% vs 2026-09-16 snapshot; no ≥5% drop trigger). HOA still unstated. Rent refresh from pipeline Barbasquillo/Manta 2BR screens: FazWaz Manta 2BR ~$732; LTR comps $600–$800 (Rentberry/Rentola/Nahla siblings); optimistic STR $800 — rent not up vs prior $732. Using $732 → 9.35% gross; optimistic $800 still ~10.2% but LTR path fails 10% screen. Need ~$783/mo for 10%. Stay ARCHIVED scout_reject; rescreen_after +30d; rescreen_count=2.",
  "property_type": "condo",
  "building_name": "Nahla",
  "unit": "D-203",
  "beds": 2,
  "baths": 2,
  "asking_price": 93949,
  "rough_monthly_rent": 732,
  "rough_gross_yield": 0.0935,
  "advertised_hoa": null,
  "rent_source": "Pipeline Barbasquillo/Manta 2BR LTR screens: FazWaz ~$732; comps $600–$800; base $732 unchanged (live portals egress-blocked)",
  "rent_confidence": "MEDIUM",
  "workflow_state": "ARCHIVED",
  "scout_decision": "REJECT",
  "archive_reason": "scout_reject",
  "rescreen_after": "2026-11-16T11:17:00Z",
  "rescreen_count": 2
}
