{
  "id": "skorpios-3br-beachfront-manta-ec",
  "address": "Skorpios Building 3BR Beachfront, Manta, Manabí, Ecuador",
  "location": "Manta, Manabí, Ecuador",
  "listing_url": "https://www.realtor.com/international/ec/manta-manabi-province/p3/",
  "market_id": "manta-ec",
  "created_at": "2026-08-10T05:00:00Z",
  "updated_at": "2026-10-22T12:38:12Z",
  "last_screened_at": "2026-10-22T12:38:12Z",
  "screening_snapshot": {
    "price": 599000,
    "rough_monthly_rent": 1200,
    "rough_gross_yield": 0.024,
    "advertised_hoa": 444,
    "screened_at": "2026-10-22T12:38:12Z"
  },
  "scout_notes": "Rescreen 2026-10-22: realtor.com /p3/ + trivo.com.ec/propiedades/skorpios + Properati/icasas/LuxuryEstate/FazWaz/Rentberry/ESR/MLS direct fetch egress-blocked (domains not in allowlist; curl empty / WebFetch reject). WebSearch for Skorpios Manta 3BR / $599k / Trivo Unidades / Luquim $699k / RS2400944 returned no sold, offline, or price-update signal. Holding last-known Trivo 3BR ask $599,000 / HOA (alícuota) $444 (0% vs 2026-09-20 snapshot; no ≥5% drop trigger). Rent refresh from pipeline El Murciélago / Malecón 3BR comps still held: FazWaz U4124306 160 m² $1,200; Rentberry Malecón 169 m² $1,800; Oceania luxury duplex $2,500 — rent not up vs snapshot $1,200. Keep $1,200 → 2.4% gross; HOA-adj (1200−444)×12/599000 ≈ 1.5%. Optimistic $1,800 still 3.6%. Need ~$4,992/mo for 10% (or ask ≤~$144k at $1,200). No rescreen trigger met. Stay ARCHIVED scout_reject; rescreen_after +30d; rescreen_count=2.",
  "property_type": "condo",
  "building_name": "Skorpios",
  "beds": 3,
  "baths": 2,
  "asking_price": 599000,
  "rough_monthly_rent": 1200,
  "rough_gross_yield": 0.024,
  "advertised_hoa": 444,
  "rent_source": "FazWaz U4124306 El Murciélago 160m² 3BR LTR $1,200; Rentberry Malecón 169m² beachfront $1,800 — using $1,200 base (live portals egress-blocked)",
  "rent_confidence": "MEDIUM",
  "workflow_state": "ARCHIVED",
  "scout_decision": "REJECT",
  "archive_reason": "scout_reject",
  "rescreen_after": "2026-11-21T12:38:12Z",
  "rescreen_count": 2
}
