{
  "id": "riva-di-mare-1br-flavio-reyes-manta-ec",
  "address": "Riva Di Mare 1BR, Av. Flavio Reyes, Manta, Manabí, Ecuador",
  "location": "Manta, Manabí, Ecuador",
  "listing_url": "https://www.ecuadorshoresrealty.com/property/stunning-ocean-view-condo-perfect-for-vacationers-residents-or-investors-manta-ecuador/",
  "market_id": "manta-ec",
  "created_at": "2026-08-10T05:00:00Z",
  "updated_at": "2026-10-21T12:34:58Z",
  "last_screened_at": "2026-10-21T12:34:58Z",
  "screening_snapshot": {
    "price": 179700,
    "rough_monthly_rent": 850,
    "rough_gross_yield": 0.0568,
    "advertised_hoa": 150,
    "screened_at": "2026-10-21T12:34:58Z"
  },
  "scout_notes": "Rescreen 2026-10-21: ecuadorshoresrealty.com direct fetch egress-blocked (allowlist reject / curl empty); WebFetch reject; WebSearch returned no sold, offline, or price-update signal for ESR stunning-ocean-view-condo / Riva Di Mare 1BR / $179,700 / FazWaz U4137091. Holding last-known ESR For Sale ask $179,700 (1/1 ocean-view condo, Av. Flavio Reyes) — 0% vs 2026-09-19 snapshot (no ≥5% drop trigger). Sibling/near-match prior FazWaz U4137091 $179,900 / alícuota $120 not reconfirmed live. HOA held at $150 (Rentola same-building alícuota $150; prior listing $150). Rent refresh from pipeline same-building comps (unchanged vs prior): FazWaz U4133544 68 m² $700 / Rentola 82 m² $800 incl. alícuota+internet / MiPropiedad 64 m² $850 todo incluido — rent not up vs snapshot $850. Keep optimistic LTR $850 → 5.7% gross; HOA-adj (850−150)×12/179700 ≈ 4.7%. Prior $950 STR still only 6.3%. Need ~$1,498/mo for 10% (or ask ≤~$102k at $850). No rescreen trigger met. Stay ARCHIVED scout_reject; rescreen_after +30d; rescreen_count=2.",
  "property_type": "condo",
  "building_name": "Riva Di Mare",
  "beds": 1,
  "baths": 1,
  "asking_price": 179700,
  "rough_monthly_rent": 850,
  "rough_gross_yield": 0.0568,
  "advertised_hoa": 150,
  "rent_source": "Same-building Riva Di Mare LTR: FazWaz U4133544 68m² $700; Rentola 82m² $800 incl. alícuota+internet; MiPropiedad 64m² $850 all-in — using $850 optimistic; live ESR/FazWaz refresh egress-blocked",
  "rent_confidence": "MEDIUM",
  "workflow_state": "ARCHIVED",
  "scout_decision": "REJECT",
  "archive_reason": "scout_reject",
  "rescreen_after": "2026-11-20T12:34:58Z",
  "rescreen_count": 2
}
