{
  "id": "3br-oceanfront-gem-manta-ec",
  "address": "3BR Oceanfront Gem, San Marino, El Murciélago, Manta, Manabí, Ecuador",
  "location": "Manta, Manabí, Ecuador",
  "listing_url": "https://mls.mls-ecuador.com/agencies/ecuador-shores-realty/listings/rs2500285",
  "market_id": "manta-ec",
  "created_at": "2026-08-10T05:00:00Z",
  "updated_at": "2026-10-09T14:00:22Z",
  "last_screened_at": "2026-10-09T14:00:22Z",
  "screening_snapshot": {
    "price": 264500,
    "rough_monthly_rent": 1500,
    "rough_gross_yield": 0.0681,
    "advertised_hoa": 273,
    "screened_at": "2026-10-09T14:00:22Z"
  },
  "scout_notes": "Rescreen 2026-10-09: mls.mls-ecuador.com direct fetch egress-blocked; RS2500285 still Active via MLS search index + ESR agency mirror (no SOLD/PENDING markers). List Price $264,500 / HOA $273 (0% vs prior $264.5k snapshot; ESR mirror $259k ≈2.1% — below 5% drop trigger). Rent refresh: San Marino 1BR LTR $700–$750; oceanfront 3BR Manta LTR comps $1,500 (FazWaz/Asia Villas) and $1,800 (Rentberry Malecón). Using optimistic oceanfront 3BR LTR $1,500 → 6.8% gross; HOA-adjusted (1500−273)×12/264500 ≈ 5.6%. Even $1,800 still 8.2% (need ~$2,204/mo for 10%). Stay ARCHIVED scout_reject; rescreen_after +30d.",
  "property_type": "condo",
  "building_name": "San Marino",
  "beds": 3,
  "baths": 2.5,
  "asking_price": 264500,
  "rough_monthly_rent": 1500,
  "rough_gross_yield": 0.0681,
  "advertised_hoa": 273,
  "rent_source": "Oceanfront 3BR Manta LTR comps $1,500–$1,800; San Marino same-building 1BR $700–$750",
  "rent_confidence": "MEDIUM",
  "mls_id": "RS2500285",
  "workflow_state": "ARCHIVED",
  "scout_decision": "REJECT",
  "archive_reason": "scout_reject",
  "rescreen_after": "2026-11-08T14:00:22Z",
  "rescreen_count": 2
}
