{
  "id": "orongo-unit-12-barbasquillo-manta-ec",
  "address": "Orongo Unit 12, Barbasquillo, Manta, Manabí, Ecuador",
  "location": "Manta, Manabí, Ecuador",
  "listing_url": "https://trivo.com.ec/propiedades/orongo/",
  "market_id": "manta-ec",
  "created_at": "2026-08-10T05:00:00Z",
  "updated_at": "2026-10-19T14:11:00Z",
  "last_screened_at": "2026-10-19T14:11:00Z",
  "screening_snapshot": {
    "price": 55503,
    "rough_monthly_rent": 450,
    "rough_gross_yield": 0.0973,
    "advertised_hoa": null,
    "screened_at": "2026-10-19T14:11:00Z"
  },
  "scout_notes": "Rescreen 2026-10-19: trivo.com.ec / orongoconstructores.com direct fetch egress-blocked (curl SSL_ERROR_SYSCALL / WebFetch allowlist reject); WebSearch returned no Orongo / $55,503 / 47.22 m² Unit 12 index hit and no sold/offline signal — treat last-known active pre-sale economics as still marketed (same egress pattern as 2026-09-18 rescreen and Aug scrape listing_url still on Trivo Orongo). Holding $55,503 ask / $450 rent (0% vs snapshot; no rent-up or ≥5% price-drop trigger). HOA/alícuota still unknown. Gross at $450 = 9.7%; optimistic $500 still only 10.8% but unsupported for ~47 m² studio vs larger Barbasquillo LTR asks. Need ~$463/mo for 10%. Stay ARCHIVED scout_reject; rescreen_after +30d; rescreen_count=2.",
  "property_type": "condo",
  "building_name": "Orongo",
  "unit": "12",
  "beds": 1,
  "baths": 1,
  "asking_price": 55503,
  "rough_monthly_rent": 450,
  "rough_gross_yield": 0.0973,
  "advertised_hoa": null,
  "rent_source": "FazWaz Manta 1BR avg ~$418–$419 + new Barbasquillo product adj → $450 (last-known; live FazWaz refresh egress-blocked)",
  "rent_confidence": "MEDIUM",
  "workflow_state": "ARCHIVED",
  "scout_decision": "REJECT",
  "archive_reason": "scout_reject",
  "rescreen_after": "2026-11-18T14:11:00Z",
  "rescreen_count": 2
}
