{
  "id": "torre-marina-1br-el-murciélago-manta-ec",
  "address": "Torre Marina 1BR, El Murciélago, Manta, Manabí, Ecuador",
  "location": "Manta, Manabí, Ecuador",
  "listing_url": "https://www.owninecuador.com/forsale/torre-marina-1",
  "market_id": "manta-ec",
  "created_at": "2026-08-10T05:00:00Z",
  "updated_at": "2026-10-23T12:16:56Z",
  "last_screened_at": "2026-10-23T12:16:56Z",
  "screening_snapshot": {
    "price": 68000,
    "rough_monthly_rent": 500,
    "rough_gross_yield": 0.0882,
    "advertised_hoa": 85,
    "screened_at": "2026-10-23T12:16:56Z"
  },
  "scout_notes": "Rescreen 2026-10-23: OwnInEcuador /forsale/torre-marina-1 + icasas.ec / manta360realty / FazWaz direct fetch egress-blocked (domains not in allowlist; curl empty / WebFetch reject). WebSearch for Torre Marina 1BR Murciélago / $68k / OwnInEcuador / 1b-marina / manta360realty 72.38 m² returned no sold, offline, or price-update signal. Holding last-known OwnInEcuador ask $68,000 / 72.38 m² 1BR/1BA / alícuota $85 (0% vs 2026-09-21 snapshot; no ≥5% drop trigger). Sibling/near-match last-known: OwnInEcuador /1b-marina furnished $69k; manta360realty same suite $70k. Rent refresh: prior FazWaz Playa Murciélago 1BR avg ~$416 + neighborhood median ~$550 — no indexed rent-up vs snapshot $500 generous LTR. Keep $500 → 8.8% gross; HOA-adj (500−85)×12/68000 ≈ 7.3% (<8% flag). Need ~$567/mo for 10% (or ask ≤~$60k at $500). No rescreen trigger met. Stay ARCHIVED scout_reject; rescreen_after +30d; rescreen_count=2.",
  "property_type": "condo",
  "building_name": "Torre Marina",
  "beds": 1,
  "baths": 1,
  "asking_price": 68000,
  "rough_monthly_rent": 500,
  "rough_gross_yield": 0.0882,
  "advertised_hoa": 85,
  "rent_source": "FazWaz Playa Murciélago 1BR avg $416 + location/amenity premium → $500 (live portals egress-blocked; unchanged vs prior)",
  "rent_confidence": "MEDIUM",
  "workflow_state": "ARCHIVED",
  "scout_decision": "REJECT",
  "archive_reason": "scout_reject",
  "rescreen_after": "2026-11-22T12:16:56Z",
  "rescreen_count": 2
}
