{
  "id": "oceania-sky-loft-manta-ec",
  "address": "Oceania Sky Loft 180, Edificio Oceania, Manta, Manabí, Ecuador",
  "location": "Manta, Manabí, Ecuador",
  "listing_url": "https://www.realtor.com/international/ec/manta-manabi-province/p2/",
  "market_id": "manta-ec",
  "created_at": "2026-08-10T05:00:00Z",
  "updated_at": "2026-10-19T14:12:00Z",
  "last_screened_at": "2026-10-19T14:12:00Z",
  "screening_snapshot": {
    "price": 187000,
    "rough_monthly_rent": 1000,
    "rough_gross_yield": 0.0642,
    "advertised_hoa": 103,
    "screened_at": "2026-10-19T14:12:00Z"
  },
  "scout_notes": "Rescreen 2026-10-19: realtor.com / mls-ecuador.com / bienesraices-ecuador.com direct fetch egress-blocked (allowlist reject / curl SSL_ERROR_SYSCALL); WebSearch returned no RS2600101 / Oceania Sky Loft 180 / $187k sold, offline, or price-update signal — treat last-known Active MLS List Price $187,000 (HOA $103/mo) as still marketed (same egress pattern as 2026-09-17 rescreen). Holding $1,000/mo same-building Oceania loft rent (Mantahomes D084 all-in; Murciélago 1BR $750–$900) — 0% vs snapshot (no rent-up or ≥5% price-drop trigger). At $187k + $1,000 → 6.4% gross; HOA-adj (1000−103)×12/187000 ≈ 5.8%. Optimistic prior $1,500 STR → 9.6% (need ~$1,558 for 10%). Stay ARCHIVED scout_reject; rescreen_after +30d; rescreen_count=2.",
  "property_type": "condo",
  "building_name": "Oceania",
  "beds": 1,
  "baths": 1.5,
  "asking_price": 187000,
  "rough_monthly_rent": 1000,
  "rough_gross_yield": 0.0642,
  "advertised_hoa": 103,
  "rent_source": "Same-building Oceania loft Mantahomes D084 $1,000/mo all-in ($800 LTR); Murciélago 1BR comps $750–$900 (live refresh egress-blocked)",
  "rent_confidence": "MEDIUM",
  "mls_id": "RS2600101",
  "workflow_state": "ARCHIVED",
  "scout_decision": "REJECT",
  "archive_reason": "scout_reject",
  "rescreen_after": "2026-11-18T14:12:00Z",
  "rescreen_count": 2
}
