{
  "id": "oceanfront-penthouse-lease-ciudad-del-mar-manta-ec",
  "address": "Penthouse Ciudad del Mar Oceanfront (lease), Manta, Manabí, Ecuador",
  "location": "Manta, Manabí, Ecuador",
  "listing_url": "https://mls-ecuador.com/en/real-estate/manta-real-estate/rl2600080",
  "market_id": "manta-ec",
  "created_at": "2026-08-10T05:00:00Z",
  "updated_at": "2026-10-18T11:53:00Z",
  "last_screened_at": "2026-10-18T11:53:00Z",
  "screening_snapshot": {
    "price": 480000,
    "rough_monthly_rent": 2400,
    "rough_gross_yield": 0.06,
    "advertised_hoa": null,
    "screened_at": "2026-10-18T11:53:00Z"
  },
  "scout_notes": "Rescreen 2026-10-18: mls-ecuador.com / bienesraices-ecuador.com direct fetch egress-blocked (curl SSL_ERROR_SYSCALL / WebFetch allowlist reject); WebSearch returned no RL2600080 / $2,400/mo / Santos Azúa index hit and no sold/offline signal — treat last-known Active Residential Lease economics as still marketed (same egress pattern as 2026-09-17 rescreen). Holding $2,400/mo rent (0% vs snapshot; no rent-up or ≥5% price-drop trigger). Still lease-only, not a purchase candidate; imputed ask remains ~$480K at 6% screening convention → 6.0% gross. Need ~$4,000/mo on that ask (or a true sale price ≤$288K at $2,400 rent) for 10%. Stay ARCHIVED scout_reject; rescreen_after +30d; rescreen_count=2.",
  "property_type": "condo",
  "building_name": "Ciudad del Mar",
  "beds": 3,
  "baths": 3,
  "asking_price": 480000,
  "rough_monthly_rent": 2400,
  "rough_gross_yield": 0.06,
  "advertised_hoa": null,
  "rent_source": "MLS lease listing RL2600080 Price per Month $2,400 (last-known Active Residential Lease; live MLS refresh egress-blocked)",
  "rent_confidence": "MEDIUM",
  "mls_id": "RL2600080",
  "workflow_state": "ARCHIVED",
  "scout_decision": "REJECT",
  "archive_reason": "scout_reject",
  "rescreen_after": "2026-11-17T11:53:00Z",
  "rescreen_count": 2
}
