{
  "id": "orongo-unit-10-barbasquillo-manta-ec",
  "address": "Orongo Unit 10, Barbasquillo, Manta, Manabí, Ecuador",
  "location": "Manta, Manabí, Ecuador",
  "listing_url": "https://trivo.com.ec/propiedades/orongo/",
  "market_id": "manta-ec",
  "created_at": "2026-08-10T05:00:00Z",
  "updated_at": "2026-08-10T06:45:00Z",
  "last_screened_at": "2026-08-10T05:00:00Z",
  "screening_snapshot": {
    "price": 49912,
    "rough_monthly_rent": 450,
    "rough_gross_yield": 0.1082,
    "advertised_hoa": null,
    "screened_at": "2026-08-10T05:00:00Z"
  },
  "scout_notes": "Pre-sale studio 44.39m² piso 1. Gross yield 10.8% at $450/mo LTR estimate.",
  "property_type": "condo",
  "building_name": "Orongo",
  "unit": "10",
  "beds": 1,
  "baths": 1,
  "asking_price": 49912,
  "rough_monthly_rent": 450,
  "rough_gross_yield": 0.1082,
  "rent_source": "FazWaz Manta 1BR median $419/mo, adjusted",
  "rent_confidence": "MEDIUM",
  "workflow_state": "READY_FOR_UNDERWRITING",
  "scout_decision": "RESEARCH"
}
