{
  "id": "lanzarote-unit-6b-el-murciélago-manta-ec",
  "address": "Lanzarote Unit 6B, El Murciélago, Manta, Manabí, Ecuador",
  "location": "Manta, Manabí, Ecuador",
  "listing_url": "https://mls-ecuador.com/en/agencies/ecuadorshoresrealty/ecuadorshoresrealty-investment/rs2300228",
  "market_id": "manta-ec",
  "created_at": "2026-08-10T05:00:00Z",
  "updated_at": "2026-10-16T12:02:00Z",
  "last_screened_at": "2026-10-16T12:02:00Z",
  "screening_snapshot": {
    "price": 198440,
    "rough_monthly_rent": 1200,
    "rough_gross_yield": 0.0726,
    "advertised_hoa": 164,
    "screened_at": "2026-10-16T12:02:00Z"
  },
  "scout_notes": "Rescreen 2026-10-16: mls-ecuador.com / ecuador shores / realtor.com / fazwaz / rentberry direct fetch egress-blocked (domains not in allowlist; curl SSL fail / WebFetch reject). WebSearch for RS2300228 / PSECI-rs2300228 / Lanzarote Unit 6B $198,440 returned no sold, offline, or price-update signal (Canary Islands Lanzarote noise only). Holding last-known MLS/PSECI ask $198,440 / HOA $164 Type B (0% vs 2026-09-15 snapshot; no ≥5% drop trigger). Rent refresh from pipeline El Murciélago / Barbasquillo 2BR: FazWaz Murciélago 2BR LTR $720; Rentola Murciélago $600; Rentberry Barbasquillo $600–$800 / Murciélago furnished ~$850; oceanfront MLS RL2600064 $1,200 — rent not up vs prior optimistic STR $1,200. Using $1,200 → 7.3% gross; HOA-adjusted (1200−164)×12/198440 ≈ 6.3%. Need ~$1,654/mo for 10% gross. Stay ARCHIVED scout_reject; rescreen_after +30d; rescreen_count=2.",
  "property_type": "condo",
  "building_name": "Lanzarote",
  "unit": "6B",
  "beds": 2,
  "baths": 2,
  "asking_price": 198440,
  "rough_monthly_rent": 1200,
  "rough_gross_yield": 0.0726,
  "advertised_hoa": 164,
  "rent_source": "Optimistic oceanfront STR $1,200 held (MLS RL2600064); pipeline refresh FazWaz Murciélago 2BR LTR $720, Rentola $600, Rentberry Barbasquillo $600–$800 / furnished ~$850 (live portals egress-blocked)",
  "rent_confidence": "MEDIUM",
  "workflow_state": "ARCHIVED",
  "scout_decision": "REJECT",
  "archive_reason": "scout_reject",
  "rescreen_after": "2026-11-15T12:02:00Z",
  "rescreen_count": 2
}
