{
  "id": "edificio-buzios-3br-manta-ec",
  "address": "Edificio Buzios 3BR, Manta, Manabí, Ecuador",
  "location": "Manta, Manabí, Ecuador",
  "listing_url": "https://mls-ecuador.com/en/real-estate/manta-real-estate/rs2500209",
  "market_id": "manta-ec",
  "created_at": "2026-08-10T05:00:00Z",
  "updated_at": "2026-10-13T14:41:52Z",
  "last_screened_at": "2026-10-13T14:41:52Z",
  "screening_snapshot": {
    "price": 289000,
    "rough_monthly_rent": 1300,
    "rough_gross_yield": 0.054,
    "advertised_hoa": 215,
    "screened_at": "2026-10-13T14:41:52Z"
  },
  "scout_notes": "Rescreen 2026-10-13: mls-ecuador.com direct fetch egress-blocked; RS2500209 (Fully Furnished Condo in Edificio Buzios, 6th floor, 164 m²) still Active via MLS index + realtor.com international syndication (id 310098663894; last updated 2026-10-06) at $289,000 / HOA $215 — 0% price change vs prior snapshot (no ≥5% drop trigger). Rent refresh: Rentberry Buzios Building 6F 3BR 155 m² ocean-view $1,300; Manta Rentals Buzios medium-term $1,500/mo (180-night min) — rent not up vs prior $1,300. Gross at $1,300 = 5.4%; HOA-adjusted (1300−215)×12/289000 ≈ 4.5%. Optimistic $1,500/mo still only 6.2% gross — need ~$2,408/mo for 10%. Stay ARCHIVED scout_reject; rescreen_after +30d; rescreen_count=2.",
  "property_type": "condo",
  "building_name": "Edificio Buzios",
  "unit": "6",
  "beds": 3,
  "baths": 2.5,
  "asking_price": 289000,
  "rough_monthly_rent": 1300,
  "rough_gross_yield": 0.054,
  "advertised_hoa": 215,
  "rent_source": "Rentberry Buzios Building 6F 3BR ocean-view $1,300; Manta Rentals Buzios $1,500/mo (180-night min)",
  "rent_confidence": "MEDIUM",
  "mls_id": "RS2500209",
  "workflow_state": "ARCHIVED",
  "scout_decision": "REJECT",
  "archive_reason": "scout_reject",
  "rescreen_after": "2026-11-12T14:41:52Z",
  "rescreen_count": 2
}
