{
  "id": "ibiza-3br-barbasquillo-260k-manta-ec",
  "address": "Ibiza 3BR Near Coast, Barbasquillo, Manta, Manabí, Ecuador",
  "location": "Manta, Manabí, Ecuador",
  "listing_url": "https://www.realtor.com/international/ec/manta-manabi-province/p2/",
  "market_id": "manta-ec",
  "created_at": "2026-08-10T05:00:00Z",
  "updated_at": "2026-10-15T12:17:38Z",
  "last_screened_at": "2026-10-15T12:17:38Z",
  "screening_snapshot": {
    "price": 260000,
    "rough_monthly_rent": 1200,
    "rough_gross_yield": 0.0554,
    "advertised_hoa": 290,
    "screened_at": "2026-10-15T12:17:38Z"
  },
  "scout_notes": "Rescreen 2026-10-15: realtor.com international (Manta p2) direct fetch egress-blocked (domain not in allowlist; curl/WebFetch fail). WebSearch for \"IBIZA: Near the Coast and Oceanfront Apartment For Sale in Barbasquillo\" / $260k returned no sold, offline, or price-update signal. Holding last-known ask $260,000 (3BR, 1,689.93 sq ft) from 2026-09-14 snapshot — 0% vs prior (no ≥5% drop trigger). Sibling Ibiza RS2500586 same floorplate still archived at $275k / HOA $290 (not a discount path for this unit). Rent refresh from pipeline Barbasquillo/Manta 3BR screens: Rentberry Barbasquillo 3BR ~$1,200; FazWaz Manta 3BR avg ~$825; Buzios oceanfront comps $1,200–$1,300; premium oceanfront ~$1,300 — rent not up vs prior $1,200. Using $1,200 → 5.5% gross; HOA-adjusted (1200−290)×12/260000 ≈ 4.2%. Optimistic $1,500/mo still only 6.9% gross — need ~$2,167/mo for 10%. Stay ARCHIVED scout_reject; rescreen_after +30d; rescreen_count=2.",
  "property_type": "condo",
  "building_name": "Ibiza",
  "beds": 3,
  "baths": 2,
  "asking_price": 260000,
  "rough_monthly_rent": 1200,
  "rough_gross_yield": 0.0554,
  "advertised_hoa": 290,
  "rent_source": "Pipeline Barbasquillo/Manta 3BR LTR screens: Rentberry ~$1,200; FazWaz avg ~$825; Buzios oceanfront $1,200–$1,300; base $1,200 unchanged (live portal refresh blocked by egress)",
  "rent_confidence": "MEDIUM",
  "workflow_state": "ARCHIVED",
  "scout_decision": "REJECT",
  "archive_reason": "scout_reject",
  "rescreen_after": "2026-11-14T12:17:38Z",
  "rescreen_count": 2
}
